{
  "remark": "test - 2",
  "purchase_date": "2026-05-04T11:11:45.175Z",
  "vendor_reference_number": "A-01",
  "party_company_user_id": "ad68f28f-e84c-4ceb-9991-1dffd745f3c1",
  "project_id": "a43a10ac-fa91-4ec3-ba8f-ac1dc944c4c9",
  "sub_category_id": null,
  "due_days": null,
  "ship_to_address_id": null,
  "bill_to_address_id": null,
  "ship_from_address_id": null,
  "bill_from_address_id": null,
  "material_amount": 970,
  "gst_amount": 174.6,
  "other_amount": 10,
  "discount": 20,
  "total_payable": 1134.6,
  "net_amount": 1134.6,
  "is_roundoff": 0,
  "other_amount_gst_percentage": 0,
  "other_amount_gst_amount": 0,
  "other_amount_text": "Additional Charges - test 1",
  "photos": [],
  "materials": []
}
